{
  "publicAddress": "",
  "a2s": {
    "address": "0.0.0.0",
    "port": 17777
  },
  "rcon": {
    "address": "127.0.0.1",
    "port": 19999,
    "password": "ChangeMe-LongAndRandom",
    "maxClients": 4,
    "permission": "admin",
    "blacklist": [],
    "whitelist": []
  },
  "game": {
    "name": "Community Server",
    "password": "",
    "passwordAdmin": "AdminPassNoSpaces",
    "admins": [
      "0ac6169c-15e4-4b5d-8073-08e602583069"
    ],
    "scenarioId": "{2B4183DF23E88249}Missions/CAH_Morton.conf",
    "maxPlayers": 64,
    "visible": true,
    "crossPlatform": true,
    "supportedPlatforms": [
      "PLATFORM_PC",
      "PLATFORM_XBL",
      "PLATFORM_PSN"
    ],
    "modsRequiredByDefault": true,
    "gameProperties": {
      "serverMaxViewDistance": 1600,
      "networkViewDistance": 1500,
      "disableThirdPerson": false,
      "fastValidation": true,
      "battlEye": true,
      "VONDisableUI": false,
      "VONDisableDirectSpeechUI": false,
      "VONCanTransmitCrossFaction": false
    },
    "mods": []
  },
  "operating": {
    "lobbyPlayerSynchronise": true,
    "playerSaveTime": 120
  }
}
