{
  "bindAddress": "0.0.0.0",
  "bindPort": 2001,
  "publicAddress": "127.0.0.1",
  "publicPort": 2001,
  "a2s": { "address": "0.0.0.0", "port": 17777 },
  "game": {
    "name": "Test Server",
    "password": "",
    "passwordAdmin": "admin",
    "admins": [],
    "scenarioId": "{ECC61978EDCC2B5A}Missions/23_Campaign.conf",
    "maxPlayers": 16,
    "visible": false,
    "gameProperties": {
      "serverMaxViewDistance": 1600,
      "serverMinGrassDistance": 50,
      "networkViewDistance": 1500,
      "disableThirdPerson": false,
      "fastValidation": true,
      "battlEye": false,
      "VONDisableUI": false,
      "VONDisableDirectSpeechUI": false,
      "VONCanTransmitCrossFaction": false
    },
    "mods": []
  }
}
